date_collected,run_time_cambodia,published_date,crop,country,topic,title,Summary,publisher_name,publisher_domain,source_type,source_name,language,url,google_news_url,search_query,summary_raw,status,published_dt_utc,published_dt_kh,clean_title,canonical_url,url_id,same_site_title_id,article_id,master_status
2026-07-17,2026-07-17 12:15:07,"Thu, 16 Jul 2026 19:13:40 GMT",Vegetables,Global,Market,Fertiliser price fallout: ‘We lost 20 per cent of our bottom line’,Global Vegetables news related to market. Key point: Fertiliser price fallout: ‘We lost 20 per cent of our bottom line’,The Weekly Times,weeklytimesnow.com.au,Google News RSS,Google News,en,https://news.google.com/rss/articles/CBMi8wFBVV95cUxQSnRVdmhNLXpfY3d5MUtSU2lRQWxXZVYwMnFISkdhRDNBRHVLSGJjSk1ibUpUNHhQbkh2b1BjMkFRVnRFQjNpdVBsbjAxalY3QmR1eWRmLTFaS2RsSlluM2IzSUJZMFRjeEN3WDR0WThfblVvb1pvSV8tdlFnRUd5OGpVS3pnV3RLM1ZRUS05Yy1VU0Y4YXFGbnRkMEdJZVVYWXR5eDQ4eFBxdXZNNzE3dUVESWRmcFFtVWNwRFJYdi01aHNLQ1ZUWDRRcVRVdGR6M1FFb2tmTDJxNUluajRkWmx6R2xqOC10V0RLblQwT2xDTHfSAfgBQVVfeXFMTUpqZ3JOVjNQd0ktYW5BMjJ2TURVWjhhZno4bUVyNUFIOXVRdkdNWGtWT1VJbm5sR2txMUNVYW1BcnNZc2xxRkZreUI4anFOR1NBSnM4UU9BU1lZenhBTjNGSWl4M0wzb3A3dy05NFJ3X3lCVDhCMUs0MHgzS2JocXBFWVlyYnR2M3pnN2YxN0pmTURUZ1d2SlJZNkJaQlJYSHlESDYtY0dUdjRRTGVBRnozODFxVXVUUmRHWVZBSHBiTjdxYTBtMTRacjBCclJiTG5RNEdCaUNwUU13TW10bG96S0JVZkNLcEd6V0h0dmFZS3ZTYS1mYW4?oc=5,https://news.google.com/rss/articles/CBMi8wFBVV95cUxQSnRVdmhNLXpfY3d5MUtSU2lRQWxXZVYwMnFISkdhRDNBRHVLSGJjSk1ibUpUNHhQbkh2b1BjMkFRVnRFQjNpdVBsbjAxalY3QmR1eWRmLTFaS2RsSlluM2IzSUJZMFRjeEN3WDR0WThfblVvb1pvSV8tdlFnRUd5OGpVS3pnV3RLM1ZRUS05Yy1VU0Y4YXFGbnRkMEdJZVVYWXR5eDQ4eFBxdXZNNzE3dUVESWRmcFFtVWNwRFJYdi01aHNLQ1ZUWDRRcVRVdGR6M1FFb2tmTDJxNUluajRkWmx6R2xqOC10V0RLblQwT2xDTHfSAfgBQVVfeXFMTUpqZ3JOVjNQd0ktYW5BMjJ2TURVWjhhZno4bUVyNUFIOXVRdkdNWGtWT1VJbm5sR2txMUNVYW1BcnNZc2xxRkZreUI4anFOR1NBSnM4UU9BU1lZenhBTjNGSWl4M0wzb3A3dy05NFJ3X3lCVDhCMUs0MHgzS2JocXBFWVlyYnR2M3pnN2YxN0pmTURUZ1d2SlJZNkJaQlJYSHlESDYtY0dUdjRRTGVBRnozODFxVXVUUmRHWVZBSHBiTjdxYTBtMTRacjBCclJiTG5RNEdCaUNwUU13TW10bG96S0JVZkNLcEd6V0h0dmFZS3ZTYS1mYW4?oc=5,global vegetable market fresh produce price,Fertiliser price fallout: ‘We lost 20 per cent of our bottom line’ The Weekly Times,ARTICLE,2026-07-16 19:13:40+00:00,2026-07-17 02:13:40+07:00,fertiliser price fallout we lost 20 per cent of our bottom line,https://news.google.com/rss/articles/CBMi8wFBVV95cUxQSnRVdmhNLXpfY3d5MUtSU2lRQWxXZVYwMnFISkdhRDNBRHVLSGJjSk1ibUpUNHhQbkh2b1BjMkFRVnRFQjNpdVBsbjAxalY3QmR1eWRmLTFaS2RsSlluM2IzSUJZMFRjeEN3WDR0WThfblVvb1pvSV8tdlFnRUd5OGpVS3pnV3RLM1ZRUS05Yy1VU0Y4YXFGbnRkMEdJZVVYWXR5eDQ4eFBxdXZNNzE3dUVESWRmcFFtVWNwRFJYdi01aHNLQ1ZUWDRRcVRVdGR6M1FFb2tmTDJxNUluajRkWmx6R2xqOC10V0RLblQwT2xDTHfSAfgBQVVfeXFMTUpqZ3JOVjNQd0ktYW5BMjJ2TURVWjhhZno4bUVyNUFIOXVRdkdNWGtWT1VJbm5sR2txMUNVYW1BcnNZc2xxRkZreUI4anFOR1NBSnM4UU9BU1lZenhBTjNGSWl4M0wzb3A3dy05NFJ3X3lCVDhCMUs0MHgzS2JocXBFWVlyYnR2M3pnN2YxN0pmTURUZ1d2SlJZNkJaQlJYSHlESDYtY0dUdjRRTGVBRnozODFxVXVUUmRHWVZBSHBiTjdxYTBtMTRacjBCclJiTG5RNEdCaUNwUU13TW10bG96S0JVZkNLcEd6V0h0dmFZS3ZTYS1mYW4?oc=5,3331dbe460899c22ab39edde3bd222e3378788c0da863ec2722237127e908d84,2c373c276447f9ec974706fb7942d2ba385527720d33aa09c6fbcda326dde5d4,4aaa781dfbc19330d47c884afa1e305fd32b3279c4e88f8227dba7b99cbd0791,NEW
2026-07-17,2026-07-17 12:15:07,"Thu, 16 Jul 2026 18:34:13 GMT",Vegetables,Global,Market,North America Fruits and Vegetables Market Expands Toward USD 166.2 Billion by 2030 | Ken Research,Global Vegetables news related to market. Key point: North America Fruits and Vegetables Market Expands Toward USD 166.2 Billion by 2030 | Ken Research,openPR.com,openpr.com,Google News RSS,Google News,en,https://news.google.com/rss/articles/CBMingFBVV95cUxOMnpuM0VLdDhKTDNFcm4xS3ctdmNSanZZMFh6bURma2twNGNIVTJnMEdGLV9lOTZoRnhRYUFlV3JTSlNXVExocXduODMzdEwtWTNNX1NjYklwb2JPQVRZaWFyT3VIYWxqWWppNVd1d1RNNkJDS1FUc2c5dDNaWHVmcTNKV3lPT3hra081blJCeVh6RGNDN3FYUGVnZ29ZZw?oc=5,https://news.google.com/rss/articles/CBMingFBVV95cUxOMnpuM0VLdDhKTDNFcm4xS3ctdmNSanZZMFh6bURma2twNGNIVTJnMEdGLV9lOTZoRnhRYUFlV3JTSlNXVExocXduODMzdEwtWTNNX1NjYklwb2JPQVRZaWFyT3VIYWxqWWppNVd1d1RNNkJDS1FUc2c5dDNaWHVmcTNKV3lPT3hra081blJCeVh6RGNDN3FYUGVnZ29ZZw?oc=5,global vegetable market fresh produce price,North America Fruits and Vegetables Market Expands Toward USD 166.2 Billion by 2030 | Ken Research openPR.com,ARTICLE,2026-07-16 18:34:13+00:00,2026-07-17 01:34:13+07:00,north america fruits and vegetables market expands toward usd 166 2 billion by 2030 ken research,https://news.google.com/rss/articles/CBMingFBVV95cUxOMnpuM0VLdDhKTDNFcm4xS3ctdmNSanZZMFh6bURma2twNGNIVTJnMEdGLV9lOTZoRnhRYUFlV3JTSlNXVExocXduODMzdEwtWTNNX1NjYklwb2JPQVRZaWFyT3VIYWxqWWppNVd1d1RNNkJDS1FUc2c5dDNaWHVmcTNKV3lPT3hra081blJCeVh6RGNDN3FYUGVnZ29ZZw?oc=5,b5fd4eddb7c5f92d11bf28e825dca138292c4cbd6b4e000aa673d246ef02197c,dd4320c6b5e496861066027e66f6af48ce3c39154d7db048e122fa3118ae99a3,cea73cbabc70f9ca6267fd7245759c344b5880cf8d0534df26975ccfed7490c4,NEW
2026-07-17,2026-07-17 12:15:05,"Thu, 16 Jul 2026 17:26:13 GMT",Rice,Global,Market,Far East and Baltic Countries Ammonium Sulfate Market Demand to Accelerate Toward 2035 on Fertilizer and Electronics Growth,Global Rice news related to market. Key point: Far East and Baltic Countries Ammonium Sulfate Market Demand to Accelerate Toward 2035 on Fertilizer and Electronics Growth,IndexBox,indexbox.io,Google News RSS,Google News,en,https://news.google.com/rss/articles/CBMi6AFBVV95cUxNaF9DUnBwZWdibkFqclk1ejVhTTRKNUprR1VWaURNWmtYVzVnX3ltT1Rna3d1THRKWWNJNlV6cU1JY2FEbEJCY0VESUtKN0NXNXZaVjRGRGFEYlBRbXZ3QThhdnE0NHRTcnJhS3ZBZWRHQVkxSU9xdFdLX2Y1Qm1oRVZUOFdDTGE1VFpVcWZuNXlsS1FPZUpPSDAzQjlRZ21rX050SWRQdDdfdk52Y3A1LXgyM21xRG4wR0hPa2J3cTNyZTVBZjI5dVJodE9ZeFBnbHU1WmpPd0IyeUk0Q015aURQRTVXRzlJ?oc=5,https://news.google.com/rss/articles/CBMi6AFBVV95cUxNaF9DUnBwZWdibkFqclk1ejVhTTRKNUprR1VWaURNWmtYVzVnX3ltT1Rna3d1THRKWWNJNlV6cU1JY2FEbEJCY0VESUtKN0NXNXZaVjRGRGFEYlBRbXZ3QThhdnE0NHRTcnJhS3ZBZWRHQVkxSU9xdFdLX2Y1Qm1oRVZUOFdDTGE1VFpVcWZuNXlsS1FPZUpPSDAzQjlRZ21rX050SWRQdDdfdk52Y3A1LXgyM21xRG4wR0hPa2J3cTNyZTVBZjI5dVJodE9ZeFBnbHU1WmpPd0IyeUk0Q015aURQRTVXRzlJ?oc=5,global rice market price export food security,Far East and Baltic Countries Ammonium Sulfate Market Demand to Accelerate Toward 2035 on Fertilizer and Electronics Growth IndexBox,ARTICLE,2026-07-16 17:26:13+00:00,2026-07-17 00:26:13+07:00,far east and baltic countries ammonium sulfate market demand to accelerate toward 2035 on fertilizer and electronics growth,https://news.google.com/rss/articles/CBMi6AFBVV95cUxNaF9DUnBwZWdibkFqclk1ejVhTTRKNUprR1VWaURNWmtYVzVnX3ltT1Rna3d1THRKWWNJNlV6cU1JY2FEbEJCY0VESUtKN0NXNXZaVjRGRGFEYlBRbXZ3QThhdnE0NHRTcnJhS3ZBZWRHQVkxSU9xdFdLX2Y1Qm1oRVZUOFdDTGE1VFpVcWZuNXlsS1FPZUpPSDAzQjlRZ21rX050SWRQdDdfdk52Y3A1LXgyM21xRG4wR0hPa2J3cTNyZTVBZjI5dVJodE9ZeFBnbHU1WmpPd0IyeUk0Q015aURQRTVXRzlJ?oc=5,6d9e598689d2c63bcf5948e8bb0b571f837fdb7340c8889e319e2b99331b546e,e4e04620a63c5484c35c5ff581645ad6a2e8cdf59a6115daec43a2549cdd1c7f,3e666958c465a18d5b5478dcfe5adf2ad2d6e8f4c2571f6d0062965a5fb3b6b1,NEW
2026-07-17,2026-07-17 12:15:07,"Thu, 16 Jul 2026 17:07:12 GMT",Vegetables,Global,Pest/Disease,Where cyclosporiasis cases stand in Canada as U.S. parasite outbreak rages,Global Vegetables news related to pest/disease. Key point: Where cyclosporiasis cases stand in Canada as U.S. parasite outbreak rages,Global News,globalnews.ca,Google News RSS,Google News,en,https://news.google.com/rss/articles/CBMiggFBVV95cUxNZy0yV0FQMFlZVGNKSGhDb0xEdV9aQ0t3c1VHbTR6QWQzdmpKYWtEYWRkMmxKOEhXLWgydVV4TE9RUHV5a1cyb3cyVDQzVVNRcFFOSC04S1VlbjV0UUxERnB6T2hOVXBsV2xhQXk3dHBTME5laGVpa2Z6TVo3aFZDcEN3?oc=5,https://news.google.com/rss/articles/CBMiggFBVV95cUxNZy0yV0FQMFlZVGNKSGhDb0xEdV9aQ0t3c1VHbTR6QWQzdmpKYWtEYWRkMmxKOEhXLWgydVV4TE9RUHV5a1cyb3cyVDQzVVNRcFFOSC04S1VlbjV0UUxERnB6T2hOVXBsV2xhQXk3dHBTME5laGVpa2Z6TVo3aFZDcEN3?oc=5,global vegetable market fresh produce price,Where cyclosporiasis cases stand in Canada as U.S. parasite outbreak rages Global News,ARTICLE,2026-07-16 17:07:12+00:00,2026-07-17 00:07:12+07:00,where cyclosporiasis cases stand in canada as u s parasite outbreak rages,https://news.google.com/rss/articles/CBMiggFBVV95cUxNZy0yV0FQMFlZVGNKSGhDb0xEdV9aQ0t3c1VHbTR6QWQzdmpKYWtEYWRkMmxKOEhXLWgydVV4TE9RUHV5a1cyb3cyVDQzVVNRcFFOSC04S1VlbjV0UUxERnB6T2hOVXBsV2xhQXk3dHBTME5laGVpa2Z6TVo3aFZDcEN3?oc=5,600b276cc32552139b8550008f9ca99ee6cc3bf4a1508a5144f2153e6936a6cc,1332c0b359c2f09ab6212b25ce4d1857a56f8d6c63ff6d6579b43023ead3f6d9,a7c85cad612b28f261d8af90f39de323d87a7bdba7eb51a280c4223b9764b854,NEW
2026-07-17,2026-07-17 12:15:07,"Thu, 16 Jul 2026 16:47:04 GMT",Vegetables,Global,Export,J&K Exports Premium Cherries & Plums to Singapore,Global Vegetables news related to export. Key point: J&K Exports Premium Cherries & Plums to Singapore,Rediff MoneyWiz,money.rediff.com,Google News RSS,Google News,en,https://news.google.com/rss/articles/CBMioAFBVV95cUxON2l6S0E1UDFUbkstOVNVMkw4V1dFMWpGVmdLQkhtdDhXdm1uSXJ3bmVtMU1mSXoxMWRkQVVLLVpRb0ZGT3h3WGk5bnZGWXAzVG5yckFtNXljQXpIcEVCWWM4OUNEdS13bl9MT2N4OVdJcFEzblRiaXN2UWlSZHdRdEhtanZwaUNjVWFSaHQtWS03RWZkbHNIandTNzRNZjF00gGmAUFVX3lxTE5mcEZJZE0wdHBaN1dJN0owRkRQVWlGQ1RxYzJxRWpYNkJHRUNFY0c4Qkd6S2dGZk1rMzVORFFpVzR1d1ViRGgwMFNMZEtzRjF3NllMOTZ4X3QtbFRxYkIxSTUwRGlIVWktaElVaS1jSTdwUVV0c1JET1IwOFFUbWxLS1Zjd1Y5OVlRRG5RakZGVTVySy1HSXBqeEJKRFc5RDh3cDBnRmc?oc=5,https://news.google.com/rss/articles/CBMioAFBVV95cUxON2l6S0E1UDFUbkstOVNVMkw4V1dFMWpGVmdLQkhtdDhXdm1uSXJ3bmVtMU1mSXoxMWRkQVVLLVpRb0ZGT3h3WGk5bnZGWXAzVG5yckFtNXljQXpIcEVCWWM4OUNEdS13bl9MT2N4OVdJcFEzblRiaXN2UWlSZHdRdEhtanZwaUNjVWFSaHQtWS03RWZkbHNIandTNzRNZjF00gGmAUFVX3lxTE5mcEZJZE0wdHBaN1dJN0owRkRQVWlGQ1RxYzJxRWpYNkJHRUNFY0c4Qkd6S2dGZk1rMzVORFFpVzR1d1ViRGgwMFNMZEtzRjF3NllMOTZ4X3QtbFRxYkIxSTUwRGlIVWktaElVaS1jSTdwUVV0c1JET1IwOFFUbWxLS1Zjd1Y5OVlRRG5RakZGVTVySy1HSXBqeEJKRFc5RDh3cDBnRmc?oc=5,global vegetable market fresh produce price,J&K Exports Premium Cherries & Plums to Singapore Rediff MoneyWiz,ARTICLE,2026-07-16 16:47:04+00:00,2026-07-16 23:47:04+07:00,j k exports premium cherries plums to singapore,https://news.google.com/rss/articles/CBMioAFBVV95cUxON2l6S0E1UDFUbkstOVNVMkw4V1dFMWpGVmdLQkhtdDhXdm1uSXJ3bmVtMU1mSXoxMWRkQVVLLVpRb0ZGT3h3WGk5bnZGWXAzVG5yckFtNXljQXpIcEVCWWM4OUNEdS13bl9MT2N4OVdJcFEzblRiaXN2UWlSZHdRdEhtanZwaUNjVWFSaHQtWS03RWZkbHNIandTNzRNZjF00gGmAUFVX3lxTE5mcEZJZE0wdHBaN1dJN0owRkRQVWlGQ1RxYzJxRWpYNkJHRUNFY0c4Qkd6S2dGZk1rMzVORFFpVzR1d1ViRGgwMFNMZEtzRjF3NllMOTZ4X3QtbFRxYkIxSTUwRGlIVWktaElVaS1jSTdwUVV0c1JET1IwOFFUbWxLS1Zjd1Y5OVlRRG5RakZGVTVySy1HSXBqeEJKRFc5RDh3cDBnRmc?oc=5,38a0c833d0f236a6c7fdd56e9de73dbf19a4f475b001b61fefaaa4fbf9d7c101,1b3b55ad23e405e3420a4b0746d44655c54d0de8e6d0da054b41d78ae4e3675b,12a6c0b7908dc02f8cc3473a17d6d4c99eab86a7ae56c3809e780e216666149f,NEW
2026-07-17,2026-07-17 12:15:05,"Thu, 16 Jul 2026 16:26:20 GMT",Rice,Global,Market,"Saudi Arabia Rice Taste Meter - Market Analysis, Forecast, Size, Trends and Insights","Global Rice news related to market. Key point: Saudi Arabia Rice Taste Meter - Market Analysis, Forecast, Size, Trends and Insights",IndexBox,indexbox.io,Google News RSS,Google News,en,https://news.google.com/rss/articles/CBMirwFBVV95cUxOMGg4TDNFWWFJNUxsLUJ3NHQzemRXbWFHMjhmTmEwcnFPaGVQbm9WOVpQdnJlWDhYZklEdGF2LWxHa21qSFZQSDNRaEZMQkZlUEcxbTh2NThrZU1ZaTExQ3VHZXZFdkk0aVlYcGtFU3FXTmhGSF9TNDUxVEgtd3R2SVFhVUJfYzkyck1jTXN0dWhJNWY5d0drRUZUdDNERmRPdkdrdjVMRmdSdEJaUFJ3?oc=5,https://news.google.com/rss/articles/CBMirwFBVV95cUxOMGg4TDNFWWFJNUxsLUJ3NHQzemRXbWFHMjhmTmEwcnFPaGVQbm9WOVpQdnJlWDhYZklEdGF2LWxHa21qSFZQSDNRaEZMQkZlUEcxbTh2NThrZU1ZaTExQ3VHZXZFdkk0aVlYcGtFU3FXTmhGSF9TNDUxVEgtd3R2SVFhVUJfYzkyck1jTXN0dWhJNWY5d0drRUZUdDNERmRPdkdrdjVMRmdSdEJaUFJ3?oc=5,global rice market price export food security,"Saudi Arabia Rice Taste Meter - Market Analysis, Forecast, Size, Trends and Insights IndexBox",ARTICLE,2026-07-16 16:26:20+00:00,2026-07-16 23:26:20+07:00,saudi arabia rice taste meter market analysis forecast size trends and insights,https://news.google.com/rss/articles/CBMirwFBVV95cUxOMGg4TDNFWWFJNUxsLUJ3NHQzemRXbWFHMjhmTmEwcnFPaGVQbm9WOVpQdnJlWDhYZklEdGF2LWxHa21qSFZQSDNRaEZMQkZlUEcxbTh2NThrZU1ZaTExQ3VHZXZFdkk0aVlYcGtFU3FXTmhGSF9TNDUxVEgtd3R2SVFhVUJfYzkyck1jTXN0dWhJNWY5d0drRUZUdDNERmRPdkdrdjVMRmdSdEJaUFJ3?oc=5,0499b4b568d49c2fae5f3efddbdd2d3d92f7d88e36374acea7592a6e5acf1a7f,24ef00caa324081db7f7b92a2a5c1a435572cea7e58f7a4329de9187d159d6de,7075d1696deb1e7687ab3900f7a89654ff76db77ca22a2be6c8bc65e26ae0700,NEW
2026-07-17,2026-07-17 12:15:07,"Thu, 16 Jul 2026 16:24:21 GMT",Vegetables,Global,General,2026 IFPA Retail Produce Manager Awards Spotlight 20 Leaders Advancing Retail Produce,Global Vegetables news related to general. Key point: 2026 IFPA Retail Produce Manager Awards Spotlight 20 Leaders Advancing Retail Produce,International Fresh Produce Association,freshproduce.com,Google News RSS,Google News,en,https://news.google.com/rss/articles/CBMi3AFBVV95cUxQcWZfME1nNjZiQ0s4WVZraWRJRDZSNzhQd1hKNUc0Ri1samkxbVFqejA4NGdIUHhBR01QeEE2eXNuVnVjcFV1NUw2RVllZzFLU0NrYllheUVHakxpVFFCck9YSlpfVWJ6bzZ1SGZCOG00ZEZqUm5RYlE5cC1JN0dJM19La1ZNc2hTM281UUJzbGNhamlHRS16Q21JaW1kYXc0VjU0Wl9aXzdjazNfQUpRSFkzU21pdFlhWDZlX2lBVC1XRFhuVjVHUllTdlh0Z1QzMDlCSVZGM2pfS3pS?oc=5,https://news.google.com/rss/articles/CBMi3AFBVV95cUxQcWZfME1nNjZiQ0s4WVZraWRJRDZSNzhQd1hKNUc0Ri1samkxbVFqejA4NGdIUHhBR01QeEE2eXNuVnVjcFV1NUw2RVllZzFLU0NrYllheUVHakxpVFFCck9YSlpfVWJ6bzZ1SGZCOG00ZEZqUm5RYlE5cC1JN0dJM19La1ZNc2hTM281UUJzbGNhamlHRS16Q21JaW1kYXc0VjU0Wl9aXzdjazNfQUpRSFkzU21pdFlhWDZlX2lBVC1XRFhuVjVHUllTdlh0Z1QzMDlCSVZGM2pfS3pS?oc=5,global vegetable market fresh produce price,2026 IFPA Retail Produce Manager Awards Spotlight 20 Leaders Advancing Retail Produce International Fresh Produce Association,ARTICLE,2026-07-16 16:24:21+00:00,2026-07-16 23:24:21+07:00,2026 ifpa retail produce manager awards spotlight 20 leaders advancing retail produce,https://news.google.com/rss/articles/CBMi3AFBVV95cUxQcWZfME1nNjZiQ0s4WVZraWRJRDZSNzhQd1hKNUc0Ri1samkxbVFqejA4NGdIUHhBR01QeEE2eXNuVnVjcFV1NUw2RVllZzFLU0NrYllheUVHakxpVFFCck9YSlpfVWJ6bzZ1SGZCOG00ZEZqUm5RYlE5cC1JN0dJM19La1ZNc2hTM281UUJzbGNhamlHRS16Q21JaW1kYXc0VjU0Wl9aXzdjazNfQUpRSFkzU21pdFlhWDZlX2lBVC1XRFhuVjVHUllTdlh0Z1QzMDlCSVZGM2pfS3pS?oc=5,147792e52508d55787a8d253246abbfd54800c5c3fb333413d6de45762b69691,51d3f6f09085afd872afb626682d9ff05abe697b559b0bf8b44e2a3c200ec6c9,1d1b9f28a13de11dc59f8daf87cfeb703ef318382f53e9a033d851169b7b8f3e,NEW
2026-07-17,2026-07-17 12:15:05,"Thu, 16 Jul 2026 16:10:09 GMT",Rice,Global,General,Iran war: From fertilizer to food crisis?,Global Rice news related to general. Key point: Iran war: From fertilizer to food crisis?,IFPRI,ifpri.org,Google News RSS,Google News,en,https://news.google.com/rss/articles/CBMidkFVX3lxTE5uTDB2TXo4VDJ2SFRFWDlOMG1HMURlTU1mLWFudWF2ZWdsb2ZqRUVDY0R5dExZSEE3eGRiVDJXRFgxRks5VjNPOWdkQlRCY0VEX0pxLW1jbnBLNXpXY0haMDFSWV8zY1BBMUQweUF1dWZpRVJWQWc?oc=5,https://news.google.com/rss/articles/CBMidkFVX3lxTE5uTDB2TXo4VDJ2SFRFWDlOMG1HMURlTU1mLWFudWF2ZWdsb2ZqRUVDY0R5dExZSEE3eGRiVDJXRFgxRks5VjNPOWdkQlRCY0VEX0pxLW1jbnBLNXpXY0haMDFSWV8zY1BBMUQweUF1dWZpRVJWQWc?oc=5,global rice market price export food security,Iran war: From fertilizer to food crisis? IFPRI,ARTICLE,2026-07-16 16:10:09+00:00,2026-07-16 23:10:09+07:00,iran war from fertilizer to food crisis,https://news.google.com/rss/articles/CBMidkFVX3lxTE5uTDB2TXo4VDJ2SFRFWDlOMG1HMURlTU1mLWFudWF2ZWdsb2ZqRUVDY0R5dExZSEE3eGRiVDJXRFgxRks5VjNPOWdkQlRCY0VEX0pxLW1jbnBLNXpXY0haMDFSWV8zY1BBMUQweUF1dWZpRVJWQWc?oc=5,005eea28b0bf3d2755272640be18ac8ccea2dde12b26eb6bbf9c6fa484e9bd25,c29053488552b1a55fe61d4f3905f14c0ff58d2b1bb9bf8bd8314f4e436322a8,f4607990704a5562410323eaaed64786696950db3d93b9d3ab409bf4ae665aa4,NEW
2026-07-17,2026-07-17 12:15:07,"Thu, 16 Jul 2026 15:46:17 GMT",Vegetables,Global,Production,"Scale-Up in FAO’s Conditional Cash for Farmers Projected to Help Feed 100,000 People","Global Vegetables news related to production. Key point: Scale-Up in FAO’s Conditional Cash for Farmers Projected to Help Feed 100,000 People",Morning Ag Clips,morningagclips.com,Google News RSS,Google News,en,https://news.google.com/rss/articles/CBMitAFBVV95cUxNckE1QW5WWUswTUNZSEM0NTVNMmlNNTNESEZfYkFjWXI1c0tQOENlcWJkLW1pT2Z4eUdRVVF5LXowWmNPRHJRVHBTVExyV0JQMEVVd1YxdVZkOUVydXdaN043RVlsZlh6MWlfMGpvZUEzaWxFd285eHhtZWlNbGFFQ2YwMlNhand2VDd4MXVCMjliSktvMk1vRThycmxFeXFqU0V4czQ5Y2xqYkFZRFdfbHdZQ1Y?oc=5,https://news.google.com/rss/articles/CBMitAFBVV95cUxNckE1QW5WWUswTUNZSEM0NTVNMmlNNTNESEZfYkFjWXI1c0tQOENlcWJkLW1pT2Z4eUdRVVF5LXowWmNPRHJRVHBTVExyV0JQMEVVd1YxdVZkOUVydXdaN043RVlsZlh6MWlfMGpvZUEzaWxFd285eHhtZWlNbGFFQ2YwMlNhand2VDd4MXVCMjliSktvMk1vRThycmxFeXFqU0V4czQ5Y2xqYkFZRFdfbHdZQ1Y?oc=5,global vegetable market fresh produce price,"Scale-Up in FAO’s Conditional Cash for Farmers Projected to Help Feed 100,000 People Morning Ag Clips",ARTICLE,2026-07-16 15:46:17+00:00,2026-07-16 22:46:17+07:00,scale up in fao s conditional cash for farmers projected to help feed 100 000 people,https://news.google.com/rss/articles/CBMitAFBVV95cUxNckE1QW5WWUswTUNZSEM0NTVNMmlNNTNESEZfYkFjWXI1c0tQOENlcWJkLW1pT2Z4eUdRVVF5LXowWmNPRHJRVHBTVExyV0JQMEVVd1YxdVZkOUVydXdaN043RVlsZlh6MWlfMGpvZUEzaWxFd285eHhtZWlNbGFFQ2YwMlNhand2VDd4MXVCMjliSktvMk1vRThycmxFeXFqU0V4czQ5Y2xqYkFZRFdfbHdZQ1Y?oc=5,67d09e44a534bcc4d156dc00de202d20c9d9eb1fd409bd738189bbce7b987381,e8ec71e612cb9551cf20391ee4d79c031d818d9a6e7c8d765c40f1cbfc8854ea,1f88e79b3691b5c771a6aeeb6f9077e8f6ac0463810d2633053778f1d3119af3,NEW
2026-07-17,2026-07-17 12:15:02,"Thu, 16 Jul 2026 15:14:15 GMT",Cashew,Global,General,Nigeria Moves to Add Value to Cashew Industry,Global Cashew news related to general. Key point: Nigeria Moves to Add Value to Cashew Industry,Voice of Nigeria,von.gov.ng,Google News RSS,Google News,en,https://news.google.com/rss/articles/CBMic0FVX3lxTFBYbXhteWRVUHljQlB6bEZXZVB3UGFfQThhVzQwdnZNZkhuVjhGcFkzblVPVC0tMTg3WWVyRXZIZUF6cjlYV19CWVE0Y2J1VUdJNXZZdlRwVTJteG5JWFg2aWJuZUQtSjd2bmdGTmFla2JRbUk?oc=5,https://news.google.com/rss/articles/CBMic0FVX3lxTFBYbXhteWRVUHljQlB6bEZXZVB3UGFfQThhVzQwdnZNZkhuVjhGcFkzblVPVC0tMTg3WWVyRXZIZUF6cjlYV19CWVE0Y2J1VUdJNXZZdlRwVTJteG5JWFg2aWJuZUQtSjd2bmdGTmFla2JRbUk?oc=5,Cambodia cashew market OR export OR price,Nigeria Moves to Add Value to Cashew Industry Voice of Nigeria,ARTICLE,2026-07-16 15:14:15+00:00,2026-07-16 22:14:15+07:00,nigeria moves to add value to cashew industry,https://news.google.com/rss/articles/CBMic0FVX3lxTFBYbXhteWRVUHljQlB6bEZXZVB3UGFfQThhVzQwdnZNZkhuVjhGcFkzblVPVC0tMTg3WWVyRXZIZUF6cjlYV19CWVE0Y2J1VUdJNXZZdlRwVTJteG5JWFg2aWJuZUQtSjd2bmdGTmFla2JRbUk?oc=5,7f67285c04e749f68eff4af8c6e24cb1c23e593354fa098db8639f71e735e7c1,4bfe8c3415ad54b6f42d5ddd4073a9c640bcaf37518aea78b63818949bd287d6,9c708845d7f4a5b968aa8b9d3413a434e8ea39748535389f3bb8e899b2b7ab50,NEW
2026-07-17,2026-07-17 12:15:07,"Thu, 16 Jul 2026 15:09:22 GMT",Vegetables,Global,Export; Production,"Gazipur farmers, traders upbeat over govt plan to export jackfruit to China","Global Vegetables news related to export; production. Key point: Gazipur farmers, traders upbeat over govt plan to export jackfruit to China",Bangladesh Sangbad Sangstha (BSS),bssnews.net,Google News RSS,Google News,en,https://news.google.com/rss/articles/CBMiWkFVX3lxTE80NGREM0o4LVplQmxBSERId0lmcEVWR0Q3dmJDcG9saDJhZ1ExUDNKdURrdTNIbmk4bk5XOTdlbmZtX3h5UDRNdklZdzNyT1JVeFNwR2RtUF9oQQ?oc=5,https://news.google.com/rss/articles/CBMiWkFVX3lxTE80NGREM0o4LVplQmxBSERId0lmcEVWR0Q3dmJDcG9saDJhZ1ExUDNKdURrdTNIbmk4bk5XOTdlbmZtX3h5UDRNdklZdzNyT1JVeFNwR2RtUF9oQQ?oc=5,global vegetable market fresh produce price,"Gazipur farmers, traders upbeat over govt plan to export jackfruit to China Bangladesh Sangbad Sangstha (BSS)",ARTICLE,2026-07-16 15:09:22+00:00,2026-07-16 22:09:22+07:00,gazipur farmers traders upbeat over govt plan to export jackfruit to china,https://news.google.com/rss/articles/CBMiWkFVX3lxTE80NGREM0o4LVplQmxBSERId0lmcEVWR0Q3dmJDcG9saDJhZ1ExUDNKdURrdTNIbmk4bk5XOTdlbmZtX3h5UDRNdklZdzNyT1JVeFNwR2RtUF9oQQ?oc=5,036b276ebf9c0fd1d9590cdcb5e58d49904be6a045d511e462d1b2dfe6c86e05,88596a748aa7745947e3bf40f8e35ab601e442e1432bff3096ffaff95a28036f,69330826519a6fb55793b353b5b2e10e4cf6c8d67ee8111b40bde2382d0b0b8a,NEW
2026-07-17,2026-07-17 12:15:07,"Thu, 16 Jul 2026 15:00:00 GMT",Vegetables,Global,Market,"Columbia Terminal Market Vegetables Prices Report (CA_FV020) – July 16, 2026 | USDA AMS - News and Statistics","Global Vegetables news related to market. Key point: Columbia Terminal Market Vegetables Prices Report (CA_FV020) – July 16, 2026 | USDA AMS - News and Statistics",IndexBox,indexbox.io,Google News RSS,Google News,en,https://news.google.com/rss/articles/CBMiowFBVV95cUxOZ29qdko2Y1JacHZ4TzloV0JFQ2g2N2lrYlNGdFoyM3pQM2lEeTRzeTBQNGsyU3Vxc3FFeFNSbDVYdWxNYkhNOVNCOTRXQlJFMHlZcklVSFAydFNUQWlXYlBPMmJCQWVJbVhCS01uSGxYTGpqT1NZbjdvM3plcnFtVGNwTDJIbW8tbWRlVVJ2cmYtQ0dTRXlPU1RPUjk3WmVMYnlz?oc=5,https://news.google.com/rss/articles/CBMiowFBVV95cUxOZ29qdko2Y1JacHZ4TzloV0JFQ2g2N2lrYlNGdFoyM3pQM2lEeTRzeTBQNGsyU3Vxc3FFeFNSbDVYdWxNYkhNOVNCOTRXQlJFMHlZcklVSFAydFNUQWlXYlBPMmJCQWVJbVhCS01uSGxYTGpqT1NZbjdvM3plcnFtVGNwTDJIbW8tbWRlVVJ2cmYtQ0dTRXlPU1RPUjk3WmVMYnlz?oc=5,global vegetable market fresh produce price,"Columbia Terminal Market Vegetables Prices Report (CA_FV020) – July 16, 2026 | USDA AMS - News and Statistics IndexBox",ARTICLE,2026-07-16 15:00:00+00:00,2026-07-16 22:00:00+07:00,columbia terminal market vegetables prices report ca fv020 july 16 2026 usda ams news and statistics,https://news.google.com/rss/articles/CBMiowFBVV95cUxOZ29qdko2Y1JacHZ4TzloV0JFQ2g2N2lrYlNGdFoyM3pQM2lEeTRzeTBQNGsyU3Vxc3FFeFNSbDVYdWxNYkhNOVNCOTRXQlJFMHlZcklVSFAydFNUQWlXYlBPMmJCQWVJbVhCS01uSGxYTGpqT1NZbjdvM3plcnFtVGNwTDJIbW8tbWRlVVJ2cmYtQ0dTRXlPU1RPUjk3WmVMYnlz?oc=5,ff2ceb455e189b2161bd0e890985040e9f9d31dc36f1785f0b2c31deb81e367f,3f11322dfe3b3216b7d5094abea82a932218aa9da8d5f37849ec18a431b984ff,1d2a2a3d6b63e1d986593d48d7b80812aca29982182a944ba3bf5bc2a96392f0,NEW
2026-07-17,2026-07-17 12:15:07,"Thu, 16 Jul 2026 15:00:00 GMT",Vegetables,Global,Market,"USDA Report: Steady Market for Greens and Green Onions in Lexington, SC (July 16, 2026)","Global Vegetables news related to market. Key point: USDA Report: Steady Market for Greens and Green Onions in Lexington, SC (July 16, 2026)",IndexBox,indexbox.io,Google News RSS,Google News,en,https://news.google.com/rss/articles/CBMisgFBVV95cUxNTVd2UTlfQTk4SzJEZGk4ZlJ0MHZFb201czE4SjRSdXJsT3R0NEdnNmwwZXZNcGhzZWptWExlZ1d2X0tQN3ZGQ0dBUnZCZFN1b1JVLUdGR0hTZG1SUFFQVTEwTjV2MFlzNHJ1OXNxNnZ1RlBPQlBsZ1dNLWJpdGZYeFVGZWJIOUo1c21QdDVTTVlKTTY5NHptWUdlQTl2MGhKQnliajlpLTJvd3laZWpXYVl3?oc=5,https://news.google.com/rss/articles/CBMisgFBVV95cUxNTVd2UTlfQTk4SzJEZGk4ZlJ0MHZFb201czE4SjRSdXJsT3R0NEdnNmwwZXZNcGhzZWptWExlZ1d2X0tQN3ZGQ0dBUnZCZFN1b1JVLUdGR0hTZG1SUFFQVTEwTjV2MFlzNHJ1OXNxNnZ1RlBPQlBsZ1dNLWJpdGZYeFVGZWJIOUo1c21QdDVTTVlKTTY5NHptWUdlQTl2MGhKQnliajlpLTJvd3laZWpXYVl3?oc=5,global vegetable market fresh produce price,"USDA Report: Steady Market for Greens and Green Onions in Lexington, SC (July 16, 2026) IndexBox",ARTICLE,2026-07-16 15:00:00+00:00,2026-07-16 22:00:00+07:00,usda report steady market for greens and green onions in lexington sc july 16 2026,https://news.google.com/rss/articles/CBMisgFBVV95cUxNTVd2UTlfQTk4SzJEZGk4ZlJ0MHZFb201czE4SjRSdXJsT3R0NEdnNmwwZXZNcGhzZWptWExlZ1d2X0tQN3ZGQ0dBUnZCZFN1b1JVLUdGR0hTZG1SUFFQVTEwTjV2MFlzNHJ1OXNxNnZ1RlBPQlBsZ1dNLWJpdGZYeFVGZWJIOUo1c21QdDVTTVlKTTY5NHptWUdlQTl2MGhKQnliajlpLTJvd3laZWpXYVl3?oc=5,5e73db826ac28ecff0aa9a7d92996b586a63ce5ea15e46cf56aff8707f3f1526,b980d3ef203afaadfac598fd276035b73a539bab785451f463b050b02328fa90,1098ccc8b7a26a7f1b266047a8209d8df27db3e03d58539705df72ef7d029a4e,NEW
2026-07-17,2026-07-17 12:15:07,"Thu, 16 Jul 2026 14:29:55 GMT",Vegetables,Global,Export,EU outlines support for Armenian fresh produce exports following Russian embargo,Global Vegetables news related to export. Key point: EU outlines support for Armenian fresh produce exports following Russian embargo,FreshPlaza,freshplaza.com,Google News RSS,Google News,en,https://news.google.com/rss/articles/CBMi1AFBVV95cUxOYTdpMXcxM1hTMXF1ellJTFhBQllvc3ViNXlRczQ4RDFYOHhWZWkyV2gtUUJuY3YyZU9FVlVObWFmTEs1QndhalFKNlpVYS05dEVYRjEtdHhaaDRtNkhqbXZFUFdZcDN6NWdranZCNzJUNHZxNndzellVMXhFQzhweHRPMzlwNjVNRll3TVd1bUZLdmVLTHdkREpDRURNeGxlUnVnX3lVdmx2cGhvSi1kLVkxMjdOSzliNGRMOW1pUUpldFNvX3ZnN0dOOUNUWWM2Rjg1UQ?oc=5,https://news.google.com/rss/articles/CBMi1AFBVV95cUxOYTdpMXcxM1hTMXF1ellJTFhBQllvc3ViNXlRczQ4RDFYOHhWZWkyV2gtUUJuY3YyZU9FVlVObWFmTEs1QndhalFKNlpVYS05dEVYRjEtdHhaaDRtNkhqbXZFUFdZcDN6NWdranZCNzJUNHZxNndzellVMXhFQzhweHRPMzlwNjVNRll3TVd1bUZLdmVLTHdkREpDRURNeGxlUnVnX3lVdmx2cGhvSi1kLVkxMjdOSzliNGRMOW1pUUpldFNvX3ZnN0dOOUNUWWM2Rjg1UQ?oc=5,global vegetable market fresh produce price,EU outlines support for Armenian fresh produce exports following Russian embargo FreshPlaza,ARTICLE,2026-07-16 14:29:55+00:00,2026-07-16 21:29:55+07:00,eu outlines support for armenian fresh produce exports following russian embargo,https://news.google.com/rss/articles/CBMi1AFBVV95cUxOYTdpMXcxM1hTMXF1ellJTFhBQllvc3ViNXlRczQ4RDFYOHhWZWkyV2gtUUJuY3YyZU9FVlVObWFmTEs1QndhalFKNlpVYS05dEVYRjEtdHhaaDRtNkhqbXZFUFdZcDN6NWdranZCNzJUNHZxNndzellVMXhFQzhweHRPMzlwNjVNRll3TVd1bUZLdmVLTHdkREpDRURNeGxlUnVnX3lVdmx2cGhvSi1kLVkxMjdOSzliNGRMOW1pUUpldFNvX3ZnN0dOOUNUWWM2Rjg1UQ?oc=5,7757c159af32df1690e629b10a9b98370c93d03e100169930fbadac2a687b97e,e7b0e14fe986194821eb4e07b80a2b255abb56181a037a9c9b5981c942659828,c16e00ab5a754e13d2321214a77f941284ad01e4dc21ac6fe7c0c32c1c57add2,NEW
