date_collected,run_time_cambodia,published_date,crop,country,topic,title,Summary,publisher_name,publisher_domain,source_type,source_name,language,url,google_news_url,search_query,summary_raw,status,published_dt_utc,published_dt_kh,clean_title,canonical_url,url_id,same_site_title_id,article_id,master_status
2026-07-16,2026-07-16 12:11:56,"Wed, 15 Jul 2026 15:07:23 GMT",Rice,Global,Market,Egypt reveals plan to stabilize basic goods prices amid regional tensions - Markets & Companies - Business,Global Rice news related to market. Key point: Egypt reveals plan to stabilize basic goods prices amid regional tensions - Markets & Companies - Business,Ahram Online,english.ahram.org.eg,Google News RSS,Google News,en,https://news.google.com/rss/articles/CBMi0gFBVV95cUxPajdxVXNZYTIwQ3ZBRUlmRjBkckxobnRWYzd2MWNTOWRJcW1JUTdTV1BNRlpHRmlOUklYN0IwWHV6Y2hpdVdUREJvcnhET0N3a01ZS2FDX0VONFJlSXBNWm93UnN6TjRkeDZuU1hzMGZsRVpfMVlyd3gzMWxGYVBqMTVYZVhUeUItcm14LXl6ZWFXT3lyLXRER2Zaa18xWTliR1lod1A5WXcwbjNRWThmdlZ2MFlmQUlDU0c3N2lEV3BiRDhvMXFGN1Y1NFMwWXY1ZUE?oc=5,https://news.google.com/rss/articles/CBMi0gFBVV95cUxPajdxVXNZYTIwQ3ZBRUlmRjBkckxobnRWYzd2MWNTOWRJcW1JUTdTV1BNRlpHRmlOUklYN0IwWHV6Y2hpdVdUREJvcnhET0N3a01ZS2FDX0VONFJlSXBNWm93UnN6TjRkeDZuU1hzMGZsRVpfMVlyd3gzMWxGYVBqMTVYZVhUeUItcm14LXl6ZWFXT3lyLXRER2Zaa18xWTliR1lod1A5WXcwbjNRWThmdlZ2MFlmQUlDU0c3N2lEV3BiRDhvMXFGN1Y1NFMwWXY1ZUE?oc=5,global rice market price export food security,Egypt reveals plan to stabilize basic goods prices amid regional tensions - Markets & Companies - Business Ahram Online,ARTICLE,2026-07-15 15:07:23+00:00,2026-07-15 22:07:23+07:00,egypt reveals plan to stabilize basic goods prices amid regional tensions markets companies business,https://news.google.com/rss/articles/CBMi0gFBVV95cUxPajdxVXNZYTIwQ3ZBRUlmRjBkckxobnRWYzd2MWNTOWRJcW1JUTdTV1BNRlpHRmlOUklYN0IwWHV6Y2hpdVdUREJvcnhET0N3a01ZS2FDX0VONFJlSXBNWm93UnN6TjRkeDZuU1hzMGZsRVpfMVlyd3gzMWxGYVBqMTVYZVhUeUItcm14LXl6ZWFXT3lyLXRER2Zaa18xWTliR1lod1A5WXcwbjNRWThmdlZ2MFlmQUlDU0c3N2lEV3BiRDhvMXFGN1Y1NFMwWXY1ZUE?oc=5,b2903f515291a6241f3b08e86998fd91c9aca833e28e36e66fe7ab217a5a278b,eb557e95652bf7c99420feb06bf337b5cbfc928f7cb70375ca9f224f9c4e7ae2,756747a7b0ad3852d5a214247bd2795c91702eae86cd2a2433d903a2951bbe80,NEW
2026-07-16,2026-07-16 12:11:58,"Wed, 15 Jul 2026 15:00:29 GMT",Vegetables,Global,Market,"Pocketbook pain: High food prices continue to challenge retailers, consumers","Global Vegetables news related to market. Key point: Pocketbook pain: High food prices continue to challenge retailers, consumers",Supermarket Perimeter,supermarketperimeter.com,Google News RSS,Google News,en,https://news.google.com/rss/articles/CBMixAFBVV95cUxOM0xVc2Jrbm9Pa1BmSFBHMFA1SEhmdHItOFp2ckF4UDJJX2ZmOHotbnRYTlNRR25xanZUMHVWMllEdkJRdkxWNG9HLVYwQmpsME9YUDJ0SnZMb1R5bWhPMFZvNnR0SXVJMEZKRENzOTc2YktZR09uUmlQaTRsSU1iTnIydXpfR25OUERkUTVLajc3Nnk5OXlNcW0tOHk2MWRnUnd0QWJFeDVVTno2WUYwZ1U0TmxqTmtGOFpMdDVYV3d4OGhN?oc=5,https://news.google.com/rss/articles/CBMixAFBVV95cUxOM0xVc2Jrbm9Pa1BmSFBHMFA1SEhmdHItOFp2ckF4UDJJX2ZmOHotbnRYTlNRR25xanZUMHVWMllEdkJRdkxWNG9HLVYwQmpsME9YUDJ0SnZMb1R5bWhPMFZvNnR0SXVJMEZKRENzOTc2YktZR09uUmlQaTRsSU1iTnIydXpfR25OUERkUTVLajc3Nnk5OXlNcW0tOHk2MWRnUnd0QWJFeDVVTno2WUYwZ1U0TmxqTmtGOFpMdDVYV3d4OGhN?oc=5,global vegetable market fresh produce price,"Pocketbook pain: High food prices continue to challenge retailers, consumers Supermarket Perimeter",ARTICLE,2026-07-15 15:00:29+00:00,2026-07-15 22:00:29+07:00,pocketbook pain high food prices continue to challenge retailers consumers,https://news.google.com/rss/articles/CBMixAFBVV95cUxOM0xVc2Jrbm9Pa1BmSFBHMFA1SEhmdHItOFp2ckF4UDJJX2ZmOHotbnRYTlNRR25xanZUMHVWMllEdkJRdkxWNG9HLVYwQmpsME9YUDJ0SnZMb1R5bWhPMFZvNnR0SXVJMEZKRENzOTc2YktZR09uUmlQaTRsSU1iTnIydXpfR25OUERkUTVLajc3Nnk5OXlNcW0tOHk2MWRnUnd0QWJFeDVVTno2WUYwZ1U0TmxqTmtGOFpMdDVYV3d4OGhN?oc=5,56485f87fb5417238a1779114a035095f3b75d219ce8a763dab783dc4228731a,dcac94fab131905b9a38d0dca496a0d467a9b59363261ef7f86b3ca4796ff66d,876106b982a8f986425aa3a5d304dea5f570ccd8c6524a9c05bdbfe481879daf,NEW
2026-07-16,2026-07-16 12:11:56,"Wed, 15 Jul 2026 14:30:09 GMT",Rice,Global,Climate Risk,Ukraine’s strikes disrupt Russia’s control of Azov Sea chokepoints,Global Rice news related to climate risk. Key point: Ukraine’s strikes disrupt Russia’s control of Azov Sea chokepoints,Межа. Новини України.,mezha.net,Google News RSS,Google News,en,https://news.google.com/rss/articles/CBMicEFVX3lxTFBnM3kzMU5hWXU2c1g2NFhmTExpem5SVVpTeHhIVHRJVlNmNXpEVGRVeXplNmtQWjRIN0p6RFdVSkRBaHdZX2ZzaExPRmNxSENGQ1ZTTHVsSjJ5cWx5NTd3dDhZaUZYczJMQk9zSFA4dGc?oc=5,https://news.google.com/rss/articles/CBMicEFVX3lxTFBnM3kzMU5hWXU2c1g2NFhmTExpem5SVVpTeHhIVHRJVlNmNXpEVGRVeXplNmtQWjRIN0p6RFdVSkRBaHdZX2ZzaExPRmNxSENGQ1ZTTHVsSjJ5cWx5NTd3dDhZaUZYczJMQk9zSFA4dGc?oc=5,global rice market price export food security,Ukraine’s strikes disrupt Russia’s control of Azov Sea chokepoints Межа. Новини України.,ARTICLE,2026-07-15 14:30:09+00:00,2026-07-15 21:30:09+07:00,ukraine s strikes disrupt russia s control of azov sea chokepoints,https://news.google.com/rss/articles/CBMicEFVX3lxTFBnM3kzMU5hWXU2c1g2NFhmTExpem5SVVpTeHhIVHRJVlNmNXpEVGRVeXplNmtQWjRIN0p6RFdVSkRBaHdZX2ZzaExPRmNxSENGQ1ZTTHVsSjJ5cWx5NTd3dDhZaUZYczJMQk9zSFA4dGc?oc=5,3caef5bbc5e9ed4e2b9ce7e807ef76ecac45ea17c7c443c67b3c73e0d5110e01,5b50c546fb282faa06b0686e2b933753b852d74ffb8fa00bd95740690256263c,4fde003d192a9bb0c05e98f513daeca45eef6b0ac258fbb1a66a1c9c3f3dc517,NEW
2026-07-16,2026-07-16 12:11:52,"Wed, 15 Jul 2026 14:26:51 GMT",Mango,Global,Export; Climate Risk,Ukraine's Resilient Stride: Protecting Grain Exports Amid Rising Tensions,Global Mango news related to export; climate risk. Key point: Ukraine's Resilient Stride: Protecting Grain Exports Amid Rising Tensions,Devdiscourse,devdiscourse.com,Google News RSS,Google News,en,https://news.google.com/rss/articles/CBMi1wFBVV95cUxOeU1yLXhtakdSS0d6c2dYWWtjeDJiVVdSdzlyNmpUTjJJdWx0bzgxUXo0VEpHUnBFRzd6S01tTGdTUkR3Z2M4TmkxcG4zbjkzWmwzTGxWREF4cTBMYzNNSWJDLU1VbFRWX2gtNklVY3Jra0dwUlZRZ3lkYnA2UUlxTVFYVExXTEQ2R2J1b0ktNnM0UUo4QTAxV2hadGw4WjR2M3puYXJsY0Nndy02dGszMXJWMW9CX1liM0VRNEtnQlNhM0FKS1FXSFJ5ZDB3TWNZRnRuLU9wVdIB1wFBVV95cUxOeU1yLXhtakdSS0d6c2dYWWtjeDJiVVdSdzlyNmpUTjJJdWx0bzgxUXo0VEpHUnBFRzd6S01tTGdTUkR3Z2M4TmkxcG4zbjkzWmwzTGxWREF4cTBMYzNNSWJDLU1VbFRWX2gtNklVY3Jra0dwUlZRZ3lkYnA2UUlxTVFYVExXTEQ2R2J1b0ktNnM0UUo4QTAxV2hadGw4WjR2M3puYXJsY0Nndy02dGszMXJWMW9CX1liM0VRNEtnQlNhM0FKS1FXSFJ5ZDB3TWNZRnRuLU9wVQ?oc=5,https://news.google.com/rss/articles/CBMi1wFBVV95cUxOeU1yLXhtakdSS0d6c2dYWWtjeDJiVVdSdzlyNmpUTjJJdWx0bzgxUXo0VEpHUnBFRzd6S01tTGdTUkR3Z2M4TmkxcG4zbjkzWmwzTGxWREF4cTBMYzNNSWJDLU1VbFRWX2gtNklVY3Jra0dwUlZRZ3lkYnA2UUlxTVFYVExXTEQ2R2J1b0ktNnM0UUo4QTAxV2hadGw4WjR2M3puYXJsY0Nndy02dGszMXJWMW9CX1liM0VRNEtnQlNhM0FKS1FXSFJ5ZDB3TWNZRnRuLU9wVdIB1wFBVV95cUxOeU1yLXhtakdSS0d6c2dYWWtjeDJiVVdSdzlyNmpUTjJJdWx0bzgxUXo0VEpHUnBFRzd6S01tTGdTUkR3Z2M4TmkxcG4zbjkzWmwzTGxWREF4cTBMYzNNSWJDLU1VbFRWX2gtNklVY3Jra0dwUlZRZ3lkYnA2UUlxTVFYVExXTEQ2R2J1b0ktNnM0UUo4QTAxV2hadGw4WjR2M3puYXJsY0Nndy02dGszMXJWMW9CX1liM0VRNEtnQlNhM0FKS1FXSFJ5ZDB3TWNZRnRuLU9wVQ?oc=5,global mango market price export climate risk,Ukraine's Resilient Stride: Protecting Grain Exports Amid Rising Tensions Devdiscourse,ARTICLE,2026-07-15 14:26:51+00:00,2026-07-15 21:26:51+07:00,ukraine s resilient stride protecting grain exports amid rising tensions,https://news.google.com/rss/articles/CBMi1wFBVV95cUxOeU1yLXhtakdSS0d6c2dYWWtjeDJiVVdSdzlyNmpUTjJJdWx0bzgxUXo0VEpHUnBFRzd6S01tTGdTUkR3Z2M4TmkxcG4zbjkzWmwzTGxWREF4cTBMYzNNSWJDLU1VbFRWX2gtNklVY3Jra0dwUlZRZ3lkYnA2UUlxTVFYVExXTEQ2R2J1b0ktNnM0UUo4QTAxV2hadGw4WjR2M3puYXJsY0Nndy02dGszMXJWMW9CX1liM0VRNEtnQlNhM0FKS1FXSFJ5ZDB3TWNZRnRuLU9wVdIB1wFBVV95cUxOeU1yLXhtakdSS0d6c2dYWWtjeDJiVVdSdzlyNmpUTjJJdWx0bzgxUXo0VEpHUnBFRzd6S01tTGdTUkR3Z2M4TmkxcG4zbjkzWmwzTGxWREF4cTBMYzNNSWJDLU1VbFRWX2gtNklVY3Jra0dwUlZRZ3lkYnA2UUlxTVFYVExXTEQ2R2J1b0ktNnM0UUo4QTAxV2hadGw4WjR2M3puYXJsY0Nndy02dGszMXJWMW9CX1liM0VRNEtnQlNhM0FKS1FXSFJ5ZDB3TWNZRnRuLU9wVQ?oc=5,457673b0fc2efebdc620f2d477a207ad7d082971ce2dd635678284142bef3fec,c59b7b701f4bd696159629f582af0ef8ffaf025fce1c617d266a87986f8b1e75,d6797364bec1f5e8670c7e0a98ade3882b825f227be3e0fbb62c3d6257cdb00e,NEW
2026-07-16,2026-07-16 12:11:52,"Wed, 15 Jul 2026 13:43:50 GMT",Mango,Global,General,FAO Forum Highlights Digital Innovation to Transform Africa's Seed Systems,Global Mango news related to general. Key point: FAO Forum Highlights Digital Innovation to Transform Africa's Seed Systems,Devdiscourse,devdiscourse.com,Google News RSS,Google News,en,https://news.google.com/rss/articles/CBMixwFBVV95cUxNVTNVMWxrZ2hqdXRGYVhhY0dCZTY0MEN6S3hRSFFSNklielNDZDBac3FsV3VCVU41WmZsQjQtSHRYZjZVSzFhdTA5MFBRbk5BMFFMdlZDNHpoT040ZHRTQWdXS0tfQmo1NTI5d2lzdG5tY2VEelYwblVvT05JX09iT05DYmN3dERlTDk2TkFFd3cxZG1TZktORkxJR1JZMFUwX2E0dHJOMGNXRkFfZm9NQmJSM2JqZTNDWVpGX2JMZlM0RnVZOVdB0gHHAUFVX3lxTE1VM1UxbGtnaGp1dEZhWGFjR0JlNjQwQ3pLeFFIUVI2SWJ6U0NkMFpzcWxXdUJVTjVaZmxCNC1IdFhmNlVLMWF1MDkwUFFuTkEwUUx2VkM0emhPTjRkdFNBZ1dLS19CajU1Mjl3aXN0bm1jZUR6VjBuVW9PTklfT2JPTkNiY3d0RGVMOTZOQUV3dzFkbVNmS05GTElHUlkwVTBfYTR0ck4wY1dGQV9mb01CYlIzYmplM0NZWkZfYkxmUzRGdVk5V0E?oc=5,https://news.google.com/rss/articles/CBMixwFBVV95cUxNVTNVMWxrZ2hqdXRGYVhhY0dCZTY0MEN6S3hRSFFSNklielNDZDBac3FsV3VCVU41WmZsQjQtSHRYZjZVSzFhdTA5MFBRbk5BMFFMdlZDNHpoT040ZHRTQWdXS0tfQmo1NTI5d2lzdG5tY2VEelYwblVvT05JX09iT05DYmN3dERlTDk2TkFFd3cxZG1TZktORkxJR1JZMFUwX2E0dHJOMGNXRkFfZm9NQmJSM2JqZTNDWVpGX2JMZlM0RnVZOVdB0gHHAUFVX3lxTE1VM1UxbGtnaGp1dEZhWGFjR0JlNjQwQ3pLeFFIUVI2SWJ6U0NkMFpzcWxXdUJVTjVaZmxCNC1IdFhmNlVLMWF1MDkwUFFuTkEwUUx2VkM0emhPTjRkdFNBZ1dLS19CajU1Mjl3aXN0bm1jZUR6VjBuVW9PTklfT2JPTkNiY3d0RGVMOTZOQUV3dzFkbVNmS05GTElHUlkwVTBfYTR0ck4wY1dGQV9mb01CYlIzYmplM0NZWkZfYkxmUzRGdVk5V0E?oc=5,global mango market price export climate risk,FAO Forum Highlights Digital Innovation to Transform Africa's Seed Systems Devdiscourse,ARTICLE,2026-07-15 13:43:50+00:00,2026-07-15 20:43:50+07:00,fao forum highlights digital innovation to transform africa s seed systems,https://news.google.com/rss/articles/CBMixwFBVV95cUxNVTNVMWxrZ2hqdXRGYVhhY0dCZTY0MEN6S3hRSFFSNklielNDZDBac3FsV3VCVU41WmZsQjQtSHRYZjZVSzFhdTA5MFBRbk5BMFFMdlZDNHpoT040ZHRTQWdXS0tfQmo1NTI5d2lzdG5tY2VEelYwblVvT05JX09iT05DYmN3dERlTDk2TkFFd3cxZG1TZktORkxJR1JZMFUwX2E0dHJOMGNXRkFfZm9NQmJSM2JqZTNDWVpGX2JMZlM0RnVZOVdB0gHHAUFVX3lxTE1VM1UxbGtnaGp1dEZhWGFjR0JlNjQwQ3pLeFFIUVI2SWJ6U0NkMFpzcWxXdUJVTjVaZmxCNC1IdFhmNlVLMWF1MDkwUFFuTkEwUUx2VkM0emhPTjRkdFNBZ1dLS19CajU1Mjl3aXN0bm1jZUR6VjBuVW9PTklfT2JPTkNiY3d0RGVMOTZOQUV3dzFkbVNmS05GTElHUlkwVTBfYTR0ck4wY1dGQV9mb01CYlIzYmplM0NZWkZfYkxmUzRGdVk5V0E?oc=5,37a9d5953ac0ee0ada43043f6746dc7f89116e56b9c381e4431ce8aa72c3802f,a8782056f2afcce365474138db427c757c0c245a729913aa4f20e6eb4a67266b,672defd4d6b0970729dba40466750266d030d84c2cbf8fc317a7ea942f17cc66,NEW
2026-07-16,2026-07-16 12:11:58,"Wed, 15 Jul 2026 13:30:00 GMT",Vegetables,Global,Export,LG Saxena flags off first export consignment of 5 MT of Ladakh's apricots to UAE,Global Vegetables news related to export. Key point: LG Saxena flags off first export consignment of 5 MT of Ladakh's apricots to UAE,Big News Network.com,bignewsnetwork.com,Google News RSS,Google News,en,https://news.google.com/rss/articles/CBMiwgFBVV95cUxQU2pkd2JJSTFRNkFDeUlaMl8xejZaNFI3eGJ0OWI5VHNBVkF5UUdoOEtCandZdWxodXh3aHNjOU1ENmtOeWlxbEUzaDQwSnllQ2xBdENNSTNJRGlTWGtURjVsZkNSa2JmNEpkM3JRR0ZuM1NNTzJGVVdfNVZXUG1HaXFvckRyX0U0M1RDWTlLMFktMlQwcGgtRjVCZzRQcFJuQUQ3c3UwNTJTV0hjc2hNeDdDdExqeWdZQ0hoNUxhc0hfZw?oc=5,https://news.google.com/rss/articles/CBMiwgFBVV95cUxQU2pkd2JJSTFRNkFDeUlaMl8xejZaNFI3eGJ0OWI5VHNBVkF5UUdoOEtCandZdWxodXh3aHNjOU1ENmtOeWlxbEUzaDQwSnllQ2xBdENNSTNJRGlTWGtURjVsZkNSa2JmNEpkM3JRR0ZuM1NNTzJGVVdfNVZXUG1HaXFvckRyX0U0M1RDWTlLMFktMlQwcGgtRjVCZzRQcFJuQUQ3c3UwNTJTV0hjc2hNeDdDdExqeWdZQ0hoNUxhc0hfZw?oc=5,global vegetable market fresh produce price,LG Saxena flags off first export consignment of 5 MT of Ladakh's apricots to UAE Big News Network.com,ARTICLE,2026-07-15 13:30:00+00:00,2026-07-15 20:30:00+07:00,lg saxena flags off first export consignment of 5 mt of ladakh s apricots to uae,https://news.google.com/rss/articles/CBMiwgFBVV95cUxQU2pkd2JJSTFRNkFDeUlaMl8xejZaNFI3eGJ0OWI5VHNBVkF5UUdoOEtCandZdWxodXh3aHNjOU1ENmtOeWlxbEUzaDQwSnllQ2xBdENNSTNJRGlTWGtURjVsZkNSa2JmNEpkM3JRR0ZuM1NNTzJGVVdfNVZXUG1HaXFvckRyX0U0M1RDWTlLMFktMlQwcGgtRjVCZzRQcFJuQUQ3c3UwNTJTV0hjc2hNeDdDdExqeWdZQ0hoNUxhc0hfZw?oc=5,ae884020b29f97929059026304d59728146b9321ada6b589ccebad63c6b7b631,5233af6c4e9d1a2e1e0318afd8db8bc3eaaa2c6bca1dd7b4760506e0c966143f,fe12a6251bcf28d564ad1ac07bb45ce512efa1ca405b530bf72703a943e23bb4,NEW
2026-07-16,2026-07-16 12:11:58,"Wed, 15 Jul 2026 13:27:27 GMT",Vegetables,Global,Market,US producer prices post largest monthly drop in 14 months on lower energy costs,Global Vegetables news related to market. Key point: US producer prices post largest monthly drop in 14 months on lower energy costs,Y100 WNCY,wncy.com,Google News RSS,Google News,en,https://news.google.com/rss/articles/CBMifkFVX3lxTFBOaDM2M25TQUlObjFqLWJFVVVzZlVURDd5bmFhUmk0T1ZYejZ4ak1NUS1KT1JUUmszaFFQR3g3cWFmRVh3cG9hdmJaNExidzZYb1M2djA0VkdEM3ZrOUhJd3ljcklBM1ZZejl5ZjFxVG4wX3R1RXJzbEc3aVZxQQ?oc=5,https://news.google.com/rss/articles/CBMifkFVX3lxTFBOaDM2M25TQUlObjFqLWJFVVVzZlVURDd5bmFhUmk0T1ZYejZ4ak1NUS1KT1JUUmszaFFQR3g3cWFmRVh3cG9hdmJaNExidzZYb1M2djA0VkdEM3ZrOUhJd3ljcklBM1ZZejl5ZjFxVG4wX3R1RXJzbEc3aVZxQQ?oc=5,global vegetable market fresh produce price,US producer prices post largest monthly drop in 14 months on lower energy costs Y100 WNCY,ARTICLE,2026-07-15 13:27:27+00:00,2026-07-15 20:27:27+07:00,us producer prices post largest monthly drop in 14 months on lower energy costs,https://news.google.com/rss/articles/CBMifkFVX3lxTFBOaDM2M25TQUlObjFqLWJFVVVzZlVURDd5bmFhUmk0T1ZYejZ4ak1NUS1KT1JUUmszaFFQR3g3cWFmRVh3cG9hdmJaNExidzZYb1M2djA0VkdEM3ZrOUhJd3ljcklBM1ZZejl5ZjFxVG4wX3R1RXJzbEc3aVZxQQ?oc=5,0bff668336688b08db5103e74a15f6caeee4a5347f60269a6e24e39e59e03392,c1228438f393a87b5fdc9ce79c9a65172b86f8c2cb0c8ef104920210dcbeae6d,3f1d4e19a68712578db1b902db6d816a29c31f1dbeff94e9efc6084527ee390c,NEW
2026-07-16,2026-07-16 12:11:52,"Wed, 15 Jul 2026 13:10:58 GMT",Mango,Global,General,Egyptian strawberry acreage set to shrink next season,Global Mango news related to general. Key point: Egyptian strawberry acreage set to shrink next season,FreshPlaza,freshplaza.com,Google News RSS,Google News,en,https://news.google.com/rss/articles/CBMisAFBVV95cUxNT2dUZ25rTk5mVi1tcE8yOF9jTEVUVWlMQ2s2aXJHUTNkSkhuTGxRYWRSSFV1akNPblBjY1IteUxOWFlOLUJJYXprZlREQWNJRFRZYXBuSlZsaVpnNDN3XzBOMTBGVTZHT1cxVzNrZWNPRHZxbU9XalBfZEdjVGtNVTB3NlhsYzYwbEphS3JwLUNzNnJBTS1yS1A2WEtaNUhsakNhQm9jdFFVQTVYNmU5cg?oc=5,https://news.google.com/rss/articles/CBMisAFBVV95cUxNT2dUZ25rTk5mVi1tcE8yOF9jTEVUVWlMQ2s2aXJHUTNkSkhuTGxRYWRSSFV1akNPblBjY1IteUxOWFlOLUJJYXprZlREQWNJRFRZYXBuSlZsaVpnNDN3XzBOMTBGVTZHT1cxVzNrZWNPRHZxbU9XalBfZEdjVGtNVTB3NlhsYzYwbEphS3JwLUNzNnJBTS1yS1A2WEtaNUhsakNhQm9jdFFVQTVYNmU5cg?oc=5,global mango market price export climate risk,Egyptian strawberry acreage set to shrink next season FreshPlaza,ARTICLE,2026-07-15 13:10:58+00:00,2026-07-15 20:10:58+07:00,egyptian strawberry acreage set to shrink next season,https://news.google.com/rss/articles/CBMisAFBVV95cUxNT2dUZ25rTk5mVi1tcE8yOF9jTEVUVWlMQ2s2aXJHUTNkSkhuTGxRYWRSSFV1akNPblBjY1IteUxOWFlOLUJJYXprZlREQWNJRFRZYXBuSlZsaVpnNDN3XzBOMTBGVTZHT1cxVzNrZWNPRHZxbU9XalBfZEdjVGtNVTB3NlhsYzYwbEphS3JwLUNzNnJBTS1yS1A2WEtaNUhsakNhQm9jdFFVQTVYNmU5cg?oc=5,069500d41fab9549eee50b1936abc4a9f3048812949faaabf3c007c801504109,68a131db6132e08617d8b56dfdfebffabf60c002d88dda135d276618900bcaf8,580dc0251720ffd31946bb4af671bd099f934739b5172df1fbd13d77fbc819c0,NEW
2026-07-16,2026-07-16 12:11:58,"Wed, 15 Jul 2026 13:10:58 GMT",Vegetables,Global,General,“Fresh produce requires non-standard logistics”,Global Vegetables news related to general. Key point: “Fresh produce requires non-standard logistics”,FreshPlaza,freshplaza.com,Google News RSS,Google News,en,https://news.google.com/rss/articles/CBMipgFBVV95cUxPUlg2REQ5amxtREViOVF5X3dGVUJxNDlGelE3eUpGeGpmWHdPV2ZUQUhKaVNUZnhlV1Z4ZE9LaDk2QW8tYkZhaGFYNzBISVhIZnRJU2c3enpHa2JaVk1tejFQdDZnbDlRUDlSR3RwRmEyWjNGNUQ1QXZ2OGxweDM0ZUNldzFhTkFxRkVOWTJHeGJ5ZTA4VjJsckRRU2puZEdaZjd0RGln?oc=5,https://news.google.com/rss/articles/CBMipgFBVV95cUxPUlg2REQ5amxtREViOVF5X3dGVUJxNDlGelE3eUpGeGpmWHdPV2ZUQUhKaVNUZnhlV1Z4ZE9LaDk2QW8tYkZhaGFYNzBISVhIZnRJU2c3enpHa2JaVk1tejFQdDZnbDlRUDlSR3RwRmEyWjNGNUQ1QXZ2OGxweDM0ZUNldzFhTkFxRkVOWTJHeGJ5ZTA4VjJsckRRU2puZEdaZjd0RGln?oc=5,global vegetable market fresh produce price,“Fresh produce requires non-standard logistics” FreshPlaza,ARTICLE,2026-07-15 13:10:58+00:00,2026-07-15 20:10:58+07:00,fresh produce requires non standard logistics,https://news.google.com/rss/articles/CBMipgFBVV95cUxPUlg2REQ5amxtREViOVF5X3dGVUJxNDlGelE3eUpGeGpmWHdPV2ZUQUhKaVNUZnhlV1Z4ZE9LaDk2QW8tYkZhaGFYNzBISVhIZnRJU2c3enpHa2JaVk1tejFQdDZnbDlRUDlSR3RwRmEyWjNGNUQ1QXZ2OGxweDM0ZUNldzFhTkFxRkVOWTJHeGJ5ZTA4VjJsckRRU2puZEdaZjd0RGln?oc=5,53d0bec28fb616e03e604b6e3c8bb861daf3981b1c358175c3b66f366f2eba5c,3b5b13636adfa08108c38c459f5f54c58b742cee2d5e607a2435ea395546b735,aba4b451c6ea5eab0008b9727c073869b6747123971e0f650a5bc0ca15c8c539,NEW
2026-07-16,2026-07-16 12:11:58,"Wed, 15 Jul 2026 13:10:58 GMT",Vegetables,Global,General,Fresh fruit inflation was +5.3% YoY and fresh veggies +9.0% YoY,Global Vegetables news related to general. Key point: Fresh fruit inflation was +5.3% YoY and fresh veggies +9.0% YoY,FreshPlaza,freshplaza.com,Google News RSS,Google News,en,https://news.google.com/rss/articles/CBMiuAFBVV95cUxOcUVTZVZ4WlVuTUl2aVA5dC1kWnZ4a2hKUWhwUnpJVDVaeXNvakFqWmU4LXVoQ01IbTgzVXJvNHdtaGNKTVFQSUtGdWFkam10bllEbFFsMjJaS2lCSUpvLW9HUTJpR2hfa2NEU2liSUlUYWFFR2VnNkNPVWtfNWdiTE9Eb19VRE9ZOXJCNmlnOGR6ZllPQ3NHRF9vbmhBMERIWlR3cGtQajNORkRpVElqV05QeG50S3R5?oc=5,https://news.google.com/rss/articles/CBMiuAFBVV95cUxOcUVTZVZ4WlVuTUl2aVA5dC1kWnZ4a2hKUWhwUnpJVDVaeXNvakFqWmU4LXVoQ01IbTgzVXJvNHdtaGNKTVFQSUtGdWFkam10bllEbFFsMjJaS2lCSUpvLW9HUTJpR2hfa2NEU2liSUlUYWFFR2VnNkNPVWtfNWdiTE9Eb19VRE9ZOXJCNmlnOGR6ZllPQ3NHRF9vbmhBMERIWlR3cGtQajNORkRpVElqV05QeG50S3R5?oc=5,global vegetable market fresh produce price,Fresh fruit inflation was +5.3% YoY and fresh veggies +9.0% YoY FreshPlaza,ARTICLE,2026-07-15 13:10:58+00:00,2026-07-15 20:10:58+07:00,fresh fruit inflation was 5 3 yoy and fresh veggies 9 0 yoy,https://news.google.com/rss/articles/CBMiuAFBVV95cUxOcUVTZVZ4WlVuTUl2aVA5dC1kWnZ4a2hKUWhwUnpJVDVaeXNvakFqWmU4LXVoQ01IbTgzVXJvNHdtaGNKTVFQSUtGdWFkam10bllEbFFsMjJaS2lCSUpvLW9HUTJpR2hfa2NEU2liSUlUYWFFR2VnNkNPVWtfNWdiTE9Eb19VRE9ZOXJCNmlnOGR6ZllPQ3NHRF9vbmhBMERIWlR3cGtQajNORkRpVElqV05QeG50S3R5?oc=5,9227be31a83ff18f903126306fff434f8c5c88f2db23c8788ce4a08fb8d34010,2e95cbae60926ca60586296babdc3c843abfbc1db9866ddec05476eb50274004,f44cd389a1d82e90d6fd593082408787f4f01747b82e91fc80628b9ca9e4d0b8,NEW
2026-07-16,2026-07-16 12:11:59,"Wed, 15 Jul 2026 11:58:00 GMT",Vegetables,Global,General,DA turns to space tech for farm planning,Global Vegetables news related to general. Key point: DA turns to space tech for farm planning,Inquirer.net,business.inquirer.net,Google News RSS,Google News,en,https://news.google.com/rss/articles/CBMigwFBVV95cUxOalpIaWg4b0R4Y0RiUVlaZi1nNGRWdXhVVzRYNVl2UzZaU19nNnpheTNVQ2RMRnpBQU9GeHpORGZqY0FzdVUtRzBvQ1dTSWpCRmZqa3Q2Nkt1aE0xcHZIMVhqbXJ5SDFSWmpDQy1CXy1sN2VuUE81U2wtMXVpTkhvbi1jZ9IBiAFBVV95cUxPbEozWFkyM2U5UnE3aTZFUVRVcGFHRmhYaVJHc3BOZHRMNWprMzJ2S2h5Ym1weHR0XzhESlJ5dzJpNndqUDJUODU0YUNvalhUS0djQjFYekFqY3FHcVBFWUZERjZKd2owU25hVnhzaFE0ZWRFcUkwaHc4NnlldW45b2Y4MnIyelFS?oc=5,https://news.google.com/rss/articles/CBMigwFBVV95cUxOalpIaWg4b0R4Y0RiUVlaZi1nNGRWdXhVVzRYNVl2UzZaU19nNnpheTNVQ2RMRnpBQU9GeHpORGZqY0FzdVUtRzBvQ1dTSWpCRmZqa3Q2Nkt1aE0xcHZIMVhqbXJ5SDFSWmpDQy1CXy1sN2VuUE81U2wtMXVpTkhvbi1jZ9IBiAFBVV95cUxPbEozWFkyM2U5UnE3aTZFUVRVcGFHRmhYaVJHc3BOZHRMNWprMzJ2S2h5Ym1weHR0XzhESlJ5dzJpNndqUDJUODU0YUNvalhUS0djQjFYekFqY3FHcVBFWUZERjZKd2owU25hVnhzaFE0ZWRFcUkwaHc4NnlldW45b2Y4MnIyelFS?oc=5,vegetable drought flood pest disease agriculture,DA turns to space tech for farm planning Inquirer.net,ARTICLE,2026-07-15 11:58:00+00:00,2026-07-15 18:58:00+07:00,da turns to space tech for farm planning,https://news.google.com/rss/articles/CBMigwFBVV95cUxOalpIaWg4b0R4Y0RiUVlaZi1nNGRWdXhVVzRYNVl2UzZaU19nNnpheTNVQ2RMRnpBQU9GeHpORGZqY0FzdVUtRzBvQ1dTSWpCRmZqa3Q2Nkt1aE0xcHZIMVhqbXJ5SDFSWmpDQy1CXy1sN2VuUE81U2wtMXVpTkhvbi1jZ9IBiAFBVV95cUxPbEozWFkyM2U5UnE3aTZFUVRVcGFHRmhYaVJHc3BOZHRMNWprMzJ2S2h5Ym1weHR0XzhESlJ5dzJpNndqUDJUODU0YUNvalhUS0djQjFYekFqY3FHcVBFWUZERjZKd2owU25hVnhzaFE0ZWRFcUkwaHc4NnlldW45b2Y4MnIyelFS?oc=5,9e8738e726122a2d5f28d980bd1d77257a9b331aa3f5fbb569dae70b54b166b4,fa39d8d57319d5bc198fa2648571bf1c302565b0f1dae1461e7008b4bcb90d95,59c7a62499cc507a183ef3a4658a9b5876a582d08838679f11c796b6b3fe18be,NEW
2026-07-16,2026-07-16 12:11:58,"Wed, 15 Jul 2026 10:53:59 GMT",Vegetables,Global,Export,"Ladakh’s Premium Apricots Head To UAE As 1,000-Tonne Lulu Export Initiative Gets Underway","Global Vegetables news related to export. Key point: Ladakh’s Premium Apricots Head To UAE As 1,000-Tonne Lulu Export Initiative Gets Underway",Swarajyamag,swarajyamag.com,Google News RSS,Google News,en,https://news.google.com/rss/articles/CBMizAFBVV95cUxNb3ljTng4eTFfQlJVMlI0b2xYVG5XeFlES29sVll4R3FpZVZ3cHBEcU9jNkFxeXpzS2pQV214TzdDNW1MWk9Memc5WmFqall2VlRPWjRibjR1NkZvM1RMLUdlLVdCbDFwSERlN1IxOFNySS1RbEdnbjdvbnVJazZwM3pzRU14SW9BMEhfNWM1MVJROTVrSE15S2V4NEEyMzlidTlJNHJrcUFsa2FEUTc1TVJvRWxxT3pVdGl5YUhQa1VxY2FmZmUzNURoWUbSAcwBQVVfeXFMTW95Y054OHkxX0JSVTJSNG9sWFRuV3hZREtvbFZZeEdxaWVWd3BwRHFPYzZBcXl6c0tqUFdteE83QzVtTFpPTHpnOVphampZdlZUT1o0Ym40dTZGbzNUTC1HZS1XQmwxcEhEZTdSMThTckktUWxHZ243b251SWs2cDN6c0VNeElvQTBIXzVjNTFSUTk1a0hNeUtleDRBMjM5YnU5STRya3FBbGthRFE3NU1Sb0VscU96VXRpeWFIUGtVcWNhZmZlMzVEaFlG?oc=5,https://news.google.com/rss/articles/CBMizAFBVV95cUxNb3ljTng4eTFfQlJVMlI0b2xYVG5XeFlES29sVll4R3FpZVZ3cHBEcU9jNkFxeXpzS2pQV214TzdDNW1MWk9Memc5WmFqall2VlRPWjRibjR1NkZvM1RMLUdlLVdCbDFwSERlN1IxOFNySS1RbEdnbjdvbnVJazZwM3pzRU14SW9BMEhfNWM1MVJROTVrSE15S2V4NEEyMzlidTlJNHJrcUFsa2FEUTc1TVJvRWxxT3pVdGl5YUhQa1VxY2FmZmUzNURoWUbSAcwBQVVfeXFMTW95Y054OHkxX0JSVTJSNG9sWFRuV3hZREtvbFZZeEdxaWVWd3BwRHFPYzZBcXl6c0tqUFdteE83QzVtTFpPTHpnOVphampZdlZUT1o0Ym40dTZGbzNUTC1HZS1XQmwxcEhEZTdSMThTckktUWxHZ243b251SWs2cDN6c0VNeElvQTBIXzVjNTFSUTk1a0hNeUtleDRBMjM5YnU5STRya3FBbGthRFE3NU1Sb0VscU96VXRpeWFIUGtVcWNhZmZlMzVEaFlG?oc=5,global vegetable market fresh produce price,"Ladakh’s Premium Apricots Head To UAE As 1,000-Tonne Lulu Export Initiative Gets Underway Swarajyamag",ARTICLE,2026-07-15 10:53:59+00:00,2026-07-15 17:53:59+07:00,ladakh s premium apricots head to uae as 1 000 tonne lulu export initiative gets underway,https://news.google.com/rss/articles/CBMizAFBVV95cUxNb3ljTng4eTFfQlJVMlI0b2xYVG5XeFlES29sVll4R3FpZVZ3cHBEcU9jNkFxeXpzS2pQV214TzdDNW1MWk9Memc5WmFqall2VlRPWjRibjR1NkZvM1RMLUdlLVdCbDFwSERlN1IxOFNySS1RbEdnbjdvbnVJazZwM3pzRU14SW9BMEhfNWM1MVJROTVrSE15S2V4NEEyMzlidTlJNHJrcUFsa2FEUTc1TVJvRWxxT3pVdGl5YUhQa1VxY2FmZmUzNURoWUbSAcwBQVVfeXFMTW95Y054OHkxX0JSVTJSNG9sWFRuV3hZREtvbFZZeEdxaWVWd3BwRHFPYzZBcXl6c0tqUFdteE83QzVtTFpPTHpnOVphampZdlZUT1o0Ym40dTZGbzNUTC1HZS1XQmwxcEhEZTdSMThTckktUWxHZ243b251SWs2cDN6c0VNeElvQTBIXzVjNTFSUTk1a0hNeUtleDRBMjM5YnU5STRya3FBbGthRFE3NU1Sb0VscU96VXRpeWFIUGtVcWNhZmZlMzVEaFlG?oc=5,5e7c12e990be3323333ca7ddb4834383356c2eb6498f8bb09e42f9ccf490f2bb,9ef66c0cd8bdc8c058e1e7a6b9ad9ab495b6b7431e6029afa5565cb7979bd452,0fcb8544825cf25dde34d1e2670852d1e3b6ea22effe302ec5c18be4f106ea6c,NEW
2026-07-16,2026-07-16 12:11:58,"Wed, 15 Jul 2026 10:00:00 GMT",Vegetables,Global,General,Assessing the Economic and Political Costs of Mandatory B50 Biodiesel,Global Vegetables news related to general. Key point: Assessing the Economic and Political Costs of Mandatory B50 Biodiesel,Kompas.id,kompas.id,Google News RSS,Google News,en,https://news.google.com/rss/articles/CBMimwFBVV95cUxOemljTllONGEyU09HeU1UTC1XWTNyUGdXTDBwbEZCYjBjSVJoSm5RbTVSd3hIYkV6YzZaZHpwa1VCNUVlR29IRTJVX2pYeEFBNnFRbjFZaGMxY1dsNUZqNjItWHVKSWxBN3dHU2tDZXZYNXdxT0xOYWRhTk9SQUx3WHlqRkxZVjRZbjlrOENxTTNpbU9xV3N0cFIwWQ?oc=5,https://news.google.com/rss/articles/CBMimwFBVV95cUxOemljTllONGEyU09HeU1UTC1XWTNyUGdXTDBwbEZCYjBjSVJoSm5RbTVSd3hIYkV6YzZaZHpwa1VCNUVlR29IRTJVX2pYeEFBNnFRbjFZaGMxY1dsNUZqNjItWHVKSWxBN3dHU2tDZXZYNXdxT0xOYWRhTk9SQUx3WHlqRkxZVjRZbjlrOENxTTNpbU9xV3N0cFIwWQ?oc=5,global vegetable market fresh produce price,Assessing the Economic and Political Costs of Mandatory B50 Biodiesel Kompas.id,ARTICLE,2026-07-15 10:00:00+00:00,2026-07-15 17:00:00+07:00,assessing the economic and political costs of mandatory b50 biodiesel,https://news.google.com/rss/articles/CBMimwFBVV95cUxOemljTllONGEyU09HeU1UTC1XWTNyUGdXTDBwbEZCYjBjSVJoSm5RbTVSd3hIYkV6YzZaZHpwa1VCNUVlR29IRTJVX2pYeEFBNnFRbjFZaGMxY1dsNUZqNjItWHVKSWxBN3dHU2tDZXZYNXdxT0xOYWRhTk9SQUx3WHlqRkxZVjRZbjlrOENxTTNpbU9xV3N0cFIwWQ?oc=5,0121e6ae4858ec7182756801c27d3b78c43a599e1787b98bae43ed5dab822ee5,e4feb0a8185f9e44f6de23a4cf336d59386125072e83991ec9f11498e5539d94,5b679c6f17cc68d16a189507d1c54f5c2bd3fc9cdb5d3911fb49c504e165628b,NEW
